<?xml version="1.0" encoding="UTF-8"?>
<!--
To change this template, choose Tools | Templates
and open the template in the editor.
-->


<form xmlns:xsi='http://www.w3.org/2001/XMLSchema-instance' xsi:noNamespaceSchemaLocation='../Form.xsd'>
    <name>Example</name>
    <fieldlist>
        <field>
            <name>Email</name>
            <type>String</type>
            <validatorlist>
                <validator>
                    <name>notEmpty</name>
                </validator>
                <validator>
                    <name>hasLength</name>
                </validator>
                <validator>
                    <name>isEmail</name>
                </validator>
            </validatorlist>
        </field>
    </fieldlist>

</form>
